{
  "profile_version": "1.0",
  "contract_binding": {
    "contract_version": "2.0"
  },
  "workflow_event_id": "event:acos:w3:workflow-001",
  "task_id": "task:acos:shadow:001",
  "observed_from_state": "TASK_READY",
  "observed_to_state": "TASK_EXECUTING",
  "observer_state": "OBSERVED",
  "source_reference": "artifact:acos:task-ready-record-001",
  "observed_at": "2026-08-20T09:02:00Z",
  "governance_status": "UNAUTHENTICATED_SHADOW",
  "authority_effect": "NONE",
  "identity_effect": "NONE",
  "execution_effect": "NONE",
  "activation_effect": "NONE",
  "eligible_for_execution": false
}
